{
  "version": "0.4",
  "status": "DRAFT",
  "source": "Dreamcoder Workbench canonical tokens (dreamcoder-dots/DreamcoderThemes/dreamcoder/tokens.json) — Dreamcoder Dark (OLED-aware) and Dreamcoder Light (Cocoa/Lúcuma); readability before decoration (WCAG/APCA)",
  "themes": {
    "dark": {
      "canvas": "#000000",
      "surface": "#0B0B0B",
      "surface-2": "#1F1F1F",
      "overlay": "#2E2E2E",
      "border-subtle": "#1F1F1F",
      "border-default": "#6B6B6B",
      "text-primary": "#E6E6E6",
      "text-secondary": "#C7C7C7",
      "text-tertiary": "#A7A7A7",
      "text-disabled": "#A7A7A7",
      "state-success": "#34D399",
      "state-warning": "#FBBF24",
      "state-error": "#FB8585",
      "state-pending": "#7DD3FC",
      "text-heading": "#F5F5F5",
      "surface-1": "#0D0D0F",
      "surface-3": "#2E2E2E",
      "border-medium": "#3A3A3A",
      "border-ui": "#767676",
      "border-hi": "#A7A7A7",
      "focus": "#3B82F6",
      "brand": "#6366F1",
      "accent": "#A5B4FC",
      "accent-2": "#D4B5FD",
      "diagnostic": "#7DD3FC",
      "sage": "#34D399",
      "lavender": "#D4B5FD",
      "mauve": "#D8B4FE",
      "info": "#7DD3FC",
      "link": "#A5B4FC",
      "link-hover": "#D4B5FD",
      "hover": "#3A3A3A",
      "pressed": "#1F1F1F",
      "comment": "#D0D0D0",
      "selection": "#3A3A3A"
    },
    "light": {
      "canvas": "#F3EADC",
      "surface": "#FFF7EA",
      "surface-2": "#DECBB1",
      "overlay": "#FFF7EA",
      "border-subtle": "#E6D7C4",
      "border-default": "#8A7358",
      "text-primary": "#17120D",
      "text-secondary": "#554638",
      "text-tertiary": "#725E4C",
      "text-disabled": "#71695D",
      "state-success": "#315B31",
      "state-warning": "#654300",
      "state-error": "#842F24",
      "state-pending": "#0D4A68",
      "text-heading": "#100C07",
      "text-muted": "#352E22",
      "bg-soft": "#E6D7C4",
      "surface-3": "#C8AD89",
      "surface-4": "#B89D7A",
      "border-ui": "#66513B",
      "border-hi": "#3E2F20",
      "focus": "#0F6570",
      "accent": "#824F16",
      "accent-2": "#A7471C",
      "diagnostic": "#0D4A68",
      "sage": "#315B31",
      "lavender": "#57478B",
      "mauve": "#7D3E64",
      "info": "#0D4A68",
      "link": "#824F16",
      "link-hover": "#A7471C",
      "hover": "#DECBB1",
      "pressed": "#C8AD89",
      "comment": "#725E4C"
    }
  },
  "accents": {
    "cocoa": {
      "base": "#824F16",
      "hover": "#A7471C",
      "active": "#8A5520",
      "dim": "#654300"
    },
    "terracotta": {
      "base": "#A7471C",
      "hover": "#B87C40",
      "active": "#8A5520",
      "dim": "#725E4C"
    }
  },
  "gradients": {
    "surface-dark": [
      "canvas",
      "surface",
      "surface-2"
    ],
    "surface-light": [
      "canvas",
      "surface"
    ],
    "brand-dark": [
      "accent",
      "accent-2"
    ],
    "brand-light": [
      "cocoa.active",
      "terracotta.active"
    ]
  },
  "typography": {
    "display": "'Space Grotesk', 'Inter', 'Geist', sans-serif",
    "sans": "'Inter', 'Geist', 'Plus Jakarta Sans', ui-sans-serif, system-ui, sans-serif",
    "mono": "'Geist Mono', 'JetBrains Mono', ui-monospace, monospace"
  },
  "radius": "0.5rem",
  "aiImage": {
    "tolerancePerChannel": 20,
    "coverageRequired": 0.92,
    "criticalText": "none",
    "provenance": "c2pa-required",
    "formats": {
      "banner": {
        "width": 1400,
        "height": 460
      },
      "social-preview": {
        "width": 1200,
        "height": 630
      },
      "icon": {
        "width": 512,
        "height": 512
      }
    }
  }
}
